{
  "jep": "1",
  "verb": "J",
  "who": "did:example:agent-789",
  "when": 1742345678,
  "what": "sha256:aa55ad4393538f14e6b4961de1a29216eed93517cb6c2631a56a5ee75edb3b7a",
  "nonce": "f47ac10b-58cc-4372-a567-0e02b2c3d479",
  "aud": "https://platform.example.com",
  "ref": null,
  "sig": "PLACEHOLDER_DETACHED_JWS"
}